symptoms,disease
"unintended weight loss, increased hunger, increased thirst, fatigue, slow-healing sores, areas of darkened skin",Diabetes Type 2
"weakness, loss of appetite, measured high fever, body ache",Viral Fever
"sweating, weight loss, headache, abdominal pain, prolonged fever, muscle ache",Typhoid
"fatigue, increased thirst, increased hunger, unintended weight loss, frequent urination, blurred vision, frequent infections, slow-healing sores",Diabetes Type 2
chest pain,Anemia
"shortness of breath, dizziness or lightheadedness",Anemia
"headache, measured high fever",Viral Fever
"frequent urination, increased hunger, unintended weight loss, slow-healing sores, numbness or tingling in the hands or feet, frequent infections, areas of darkened skin, blurred vision",Diabetes Type 2
"slow-healing sores, numbness or tingling in the hands or feet, blurred vision",Diabetes Type 2
"sweating, anemia, vomiting, diarrhea, nausea",Malaria
areas of darkened skin,Diabetes Type 2
"muscle ache, sweating, loss of appetite, abdominal pain, weight loss, headache, fatigue, weakness",Typhoid
"areas of darkened skin, increased thirst, slow-healing sores, increased hunger, fatigue, frequent urination",Diabetes Type 2
"severe headache, pain behind eyes, nausea, severe joint and muscle pain, mild bleeding, vomiting, sudden high fever, fatigue, skin rash",Dengue
"chest pain, cold hands and feet, fatigue, weakness, headache, irregular heartbeats, shortness of breath, dizziness or lightheadedness",Anemia
"shortness of breath, fatigue, cold hands and feet, headache, irregular heartbeats, weakness, dizziness or lightheadedness, pale or yellowish skin",Anemia
"fatigue, areas of darkened skin",Diabetes Type 2
"areas of darkened skin, increased hunger, numbness or tingling in the hands or feet",Diabetes Type 2
"pain behind eyes, fatigue, sudden high fever, severe headache, mild bleeding, severe joint and muscle pain, nausea",Dengue
"sudden high fever, mild bleeding, severe joint and muscle pain, severe headache, vomiting, fatigue, skin rash, pain behind eyes, nausea",Dengue
"chills, headache, body ache, loss of appetite, weakness, fatigue, measured high fever",Viral Fever
"vomiting, anemia, sweating, muscle pain, abdominal pain, nausea, fever with shaking chills, diarrhea",Malaria
impaired memory,Hypothyroidism
"slow-healing sores, frequent urination, increased thirst, numbness or tingling in the hands or feet, frequent infections, fatigue, unintended weight loss",Diabetes Type 2
"mild bleeding, severe joint and muscle pain",Dengue
"frequent urination, increased hunger, increased thirst, numbness or tingling in the hands or feet, unintended weight loss, blurred vision, slow-healing sores, areas of darkened skin",Diabetes Type 2
"headache, irregular heartbeats, cold hands and feet, fatigue, pale or yellowish skin, chest pain, shortness of breath, dizziness or lightheadedness",Anemia
muscle ache,Typhoid
slow-healing sores,Diabetes Type 2
"increased sensitivity to cold, elevated blood cholesterol",Hypothyroidism
"unintended weight loss, increased hunger, numbness or tingling in the hands or feet, blurred vision, frequent urination, increased thirst, frequent infections, slow-healing sores, areas of darkened skin",Diabetes Type 2
"congestion, slight body aches, sore throat, mild headache, malaise, low-grade fever",Common Cold
"mild bleeding, sudden high fever, pain behind eyes, vomiting",Dengue
"congestion, sneezing, runny or stuffy nose, mild headache, malaise, slight body aches, sore throat, low-grade fever, cough",Common Cold
rash,Typhoid
"diarrhea or constipation, weight loss, loss of appetite",Typhoid
"numbness or tingling in the hands or feet, areas of darkened skin, increased hunger, frequent urination, fatigue, frequent infections",Diabetes Type 2
"heavy or irregular menstrual periods, pain, stiffness or swelling in your joints, thinning hair, muscle aches, fatigue, tenderness and stiffness, dry skin, depression, weight gain, muscle weakness, constipation, puffy face, slowed heart rate",Hypothyroidism
"blurred vision, frequent urination, slow-healing sores, increased thirst, unintended weight loss, frequent infections, fatigue, increased hunger, areas of darkened skin, numbness or tingling in the hands or feet",Diabetes Type 2
"increased thirst, unintended weight loss, frequent urination, frequent infections, increased hunger, fatigue, areas of darkened skin, slow-healing sores",Diabetes Type 2
dizziness or lightheadedness,Anemia
"dizziness or lightheadedness, headache, weakness, irregular heartbeats, chest pain, fatigue",Anemia
"dizziness or lightheadedness, weakness, irregular heartbeats, chest pain, shortness of breath",Anemia
"malaise, congestion, low-grade fever, mild headache, cough, sneezing, sore throat, runny or stuffy nose, slight body aches",Common Cold
"dry cough, fatigue, abdominal pain, prolonged fever, diarrhea or constipation, rash",Typhoid
"elevated blood cholesterol, fatigue, thinning hair, slowed heart rate, muscle aches, pain, stiffness or swelling in your joints, hoarseness, impaired memory, constipation, weight gain, heavy or irregular menstrual periods, puffy face, tenderness and stiffness, dry skin, increased sensitivity to cold",Hypothyroidism
"areas of darkened skin, frequent infections, slow-healing sores",Diabetes Type 2
"thinning hair, muscle aches, muscle weakness, weight gain, heavy or irregular menstrual periods, fatigue, hoarseness",Hypothyroidism
"numbness or tingling in the hands or feet, fatigue, frequent urination, slow-healing sores, areas of darkened skin, increased hunger",Diabetes Type 2
"chest pain, irregular heartbeats, shortness of breath",Anemia
"pain, stiffness or swelling in your joints, tenderness and stiffness, slowed heart rate, thinning hair, constipation, hoarseness, fatigue, increased sensitivity to cold, dry skin, muscle aches, weight gain, depression, heavy or irregular menstrual periods, muscle weakness, puffy face, elevated blood cholesterol",Hypothyroidism
"nausea, pain behind eyes, vomiting, skin rash, fatigue",Dengue
"anemia, fever with shaking chills, sweating",Malaria
"fatigue, frequent urination",Diabetes Type 2
"runny or stuffy nose, congestion, mild headache, sore throat, cough, malaise",Common Cold
"headache, pale or yellowish skin, irregular heartbeats, fatigue, dizziness or lightheadedness, shortness of breath, cold hands and feet",Anemia
"fatigue, measured high fever, loss of appetite, chills, body ache, weakness",Viral Fever
abdominal pain,Malaria
"slowed heart rate, muscle weakness, dry skin, muscle aches, thinning hair, pain, stiffness or swelling in your joints, tenderness and stiffness, impaired memory, fatigue, constipation, hoarseness, depression",Hypothyroidism
"weakness, rash",Typhoid
blurred vision,Diabetes Type 2
"fever with shaking chills, sweating, vomiting, nausea, diarrhea, anemia",Malaria
"skin rash, nausea, vomiting, pain behind eyes, severe joint and muscle pain, sudden high fever, severe headache, fatigue",Dengue
"sweating, anemia, diarrhea, nausea, muscle pain, vomiting, headache, abdominal pain, fever with shaking chills",Malaria
"increased hunger, areas of darkened skin, fatigue, frequent urination, frequent infections, numbness or tingling in the hands or feet, slow-healing sores, increased thirst",Diabetes Type 2
malaise,Common Cold
"slowed heart rate, muscle aches, depression, hoarseness, muscle weakness, fatigue, increased sensitivity to cold, impaired memory, dry skin, constipation, tenderness and stiffness, thinning hair, pain, stiffness or swelling in your joints, elevated blood cholesterol, puffy face, heavy or irregular menstrual periods",Hypothyroidism
"irregular heartbeats, headache, chest pain, dizziness or lightheadedness, fatigue",Anemia
"muscle weakness, muscle aches, thinning hair, weight gain, elevated blood cholesterol, slowed heart rate, constipation, heavy or irregular menstrual periods, puffy face, tenderness and stiffness",Hypothyroidism
severe joint and muscle pain,Dengue
"vomiting, sweating, headache, muscle pain, fever with shaking chills",Malaria
"skin rash, severe headache, nausea, sudden high fever, pain behind eyes, severe joint and muscle pain, mild bleeding, fatigue, vomiting",Dengue
"chills, measured high fever, body ache, loss of appetite, fatigue",Viral Fever
slight body aches,Common Cold
"sweating, dry cough, prolonged fever, headache, weakness, loss of appetite, weight loss, muscle ache, abdominal pain",Typhoid
"anemia, diarrhea, headache, fever with shaking chills, vomiting, abdominal pain, nausea, sweating",Malaria
"dizziness or lightheadedness, fatigue, shortness of breath, weakness, pale or yellowish skin",Anemia
"muscle ache, fatigue, dry cough, prolonged fever, headache, diarrhea or constipation, abdominal pain, sweating, rash, loss of appetite, weight loss, weakness",Typhoid
"muscle weakness, weight gain, dry skin, thinning hair, fatigue, elevated blood cholesterol, depression",Hypothyroidism
fatigue,Typhoid
"frequent infections, numbness or tingling in the hands or feet, frequent urination, blurred vision, increased hunger",Diabetes Type 2
"sore throat, runny or stuffy nose, cough, mild headache",Common Cold
abdominal pain,Malaria
"fatigue, unintended weight loss, slow-healing sores, numbness or tingling in the hands or feet, frequent urination, increased hunger, areas of darkened skin, frequent infections, blurred vision",Diabetes Type 2
loss of appetite,Typhoid
"cough, runny or stuffy nose, sneezing, mild headache, low-grade fever",Common Cold
"dry cough, weight loss, diarrhea or constipation, abdominal pain, prolonged fever, weakness, muscle ache, rash, loss of appetite, fatigue, headache",Typhoid
"skin rash, mild bleeding, vomiting, pain behind eyes, severe joint and muscle pain, nausea, sudden high fever",Dengue
"mild headache, cough, runny or stuffy nose, low-grade fever, sore throat, malaise, sneezing, congestion",Common Cold
"slight body aches, congestion, cough",Common Cold
"prolonged fever, weight loss",Typhoid
"chest pain, cold hands and feet, pale or yellowish skin",Anemia
"pale or yellowish skin, cold hands and feet, shortness of breath",Anemia
"dry skin, constipation, depression, fatigue, weight gain, elevated blood cholesterol, muscle aches, thinning hair",Hypothyroidism
"headache, weakness, loss of appetite",Viral Fever
"pain behind eyes, nausea, vomiting",Dengue
"mild headache, slight body aches, runny or stuffy nose, cough, congestion, sneezing, low-grade fever",Common Cold
"sweating, weakness, rash, dry cough, muscle ache",Typhoid
"heavy or irregular menstrual periods, impaired memory, constipation, fatigue",Hypothyroidism
"mild headache, sneezing, cough",Common Cold
"congestion, runny or stuffy nose",Common Cold
"vomiting, skin rash, severe joint and muscle pain",Dengue
"shortness of breath, weakness, headache",Anemia
"rash, diarrhea or constipation, sweating, fatigue, dry cough, weakness, headache, prolonged fever, weight loss, loss of appetite",Typhoid
weakness,Anemia
"fatigue, weakness, shortness of breath",Anemia
"body ache, headache, fatigue, measured high fever, chills",Viral Fever
"dry skin, pain, stiffness or swelling in your joints, thinning hair, increased sensitivity to cold, impaired memory, weight gain, heavy or irregular menstrual periods, slowed heart rate, constipation, depression, hoarseness",Hypothyroidism
"nausea, pain behind eyes, fatigue, mild bleeding, severe headache, vomiting",Dengue
"pain behind eyes, severe joint and muscle pain, fatigue, vomiting, sudden high fever, mild bleeding, severe headache",Dengue
"fatigue, severe joint and muscle pain, skin rash, pain behind eyes, severe headache, sudden high fever, vomiting, mild bleeding, nausea",Dengue
"fatigue, weakness, irregular heartbeats, shortness of breath, dizziness or lightheadedness",Anemia
"pain behind eyes, mild bleeding",Dengue
"fatigue, weakness, chills",Viral Fever
"sweating, fever with shaking chills, muscle pain, vomiting",Malaria
"measured high fever, chills, weakness, body ache, loss of appetite",Viral Fever
dry skin,Hypothyroidism
"muscle aches, constipation, fatigue, pain, stiffness or swelling in your joints, impaired memory, dry skin, hoarseness, slowed heart rate, increased sensitivity to cold, heavy or irregular menstrual periods, thinning hair, muscle weakness, elevated blood cholesterol, weight gain, tenderness and stiffness, depression, puffy face",Hypothyroidism
blurred vision,Diabetes Type 2
"cough, congestion, slight body aches, sore throat, malaise, mild headache, runny or stuffy nose, low-grade fever, sneezing",Common Cold
"fatigue, sudden high fever, nausea, vomiting, severe joint and muscle pain, skin rash, mild bleeding, pain behind eyes",Dengue
"fatigue, muscle ache, diarrhea or constipation, sweating, prolonged fever, rash, headache, loss of appetite, weakness",Typhoid
"slow-healing sores, unintended weight loss, numbness or tingling in the hands or feet, frequent urination, fatigue, areas of darkened skin",Diabetes Type 2
"slow-healing sores, frequent infections, areas of darkened skin, unintended weight loss, numbness or tingling in the hands or feet, blurred vision, increased hunger, increased thirst",Diabetes Type 2
"abdominal pain, muscle ache",Typhoid
"slowed heart rate, thinning hair, weight gain, heavy or irregular menstrual periods, constipation, depression, muscle weakness",Hypothyroidism
"shortness of breath, cold hands and feet, headache, pale or yellowish skin, fatigue, dizziness or lightheadedness, chest pain, irregular heartbeats, weakness",Anemia
"nausea, abdominal pain, diarrhea, muscle pain",Malaria
"runny or stuffy nose, sore throat, congestion, sneezing, low-grade fever, slight body aches, cough, malaise, mild headache",Common Cold
"diarrhea, anemia, fever with shaking chills, headache, sweating, nausea, muscle pain, vomiting",Malaria
"congestion, low-grade fever",Common Cold
"sudden high fever, severe joint and muscle pain, skin rash",Dengue
"weakness, prolonged fever, headache, weight loss, diarrhea or constipation, muscle ache, abdominal pain, dry cough, loss of appetite",Typhoid
"prolonged fever, dry cough, muscle ache, headache, diarrhea or constipation, loss of appetite, weight loss, fatigue, rash, weakness, sweating",Typhoid
"weakness, chills, measured high fever, fatigue",Viral Fever
"elevated blood cholesterol, constipation, fatigue, tenderness and stiffness, muscle aches, heavy or irregular menstrual periods, dry skin, slowed heart rate, impaired memory, thinning hair",Hypothyroidism
"irregular heartbeats, chest pain, headache",Anemia
"headache, anemia",Malaria
"low-grade fever, mild headache, runny or stuffy nose, cough, sore throat, congestion",Common Cold
"fatigue, severe headache, skin rash, sudden high fever, mild bleeding, severe joint and muscle pain",Dengue
headache,Malaria
"chills, headache, fatigue, loss of appetite, body ache, weakness",Viral Fever
"thinning hair, muscle aches, heavy or irregular menstrual periods, puffy face, fatigue, pain, stiffness or swelling in your joints",Hypothyroidism
nausea,Dengue
"congestion, sneezing, malaise, low-grade fever",Common Cold
"blurred vision, areas of darkened skin",Diabetes Type 2
"prolonged fever, rash, weakness, fatigue, sweating, abdominal pain, muscle ache, weight loss, headache, loss of appetite, diarrhea or constipation, dry cough",Typhoid
"chest pain, headache, fatigue",Anemia
"fatigue, frequent urination",Diabetes Type 2
"hoarseness, elevated blood cholesterol, impaired memory, increased sensitivity to cold, constipation, weight gain, tenderness and stiffness, puffy face, thinning hair, muscle aches, slowed heart rate, fatigue, depression, muscle weakness, dry skin, pain, stiffness or swelling in your joints",Hypothyroidism
"malaise, mild headache, sore throat, low-grade fever, congestion, slight body aches, runny or stuffy nose, sneezing",Common Cold
"numbness or tingling in the hands or feet, increased thirst, areas of darkened skin, frequent urination, fatigue",Diabetes Type 2
"muscle aches, thinning hair, elevated blood cholesterol, slowed heart rate, weight gain, pain, stiffness or swelling in your joints, puffy face, hoarseness, tenderness and stiffness, constipation, heavy or irregular menstrual periods",Hypothyroidism
"dry cough, sweating, prolonged fever",Typhoid
"abdominal pain, headache, sweating",Malaria
"chills, loss of appetite, headache, weakness",Viral Fever
"weakness, fatigue, dry cough",Typhoid
"low-grade fever, cough, runny or stuffy nose, sneezing, malaise, mild headache, congestion",Common Cold
"weakness, fatigue, pale or yellowish skin, shortness of breath, headache, cold hands and feet, irregular heartbeats, chest pain",Anemia
"prolonged fever, weight loss, rash, headache, diarrhea or constipation, weakness",Typhoid
"hoarseness, elevated blood cholesterol, heavy or irregular menstrual periods, muscle weakness, puffy face, thinning hair, slowed heart rate, muscle aches, tenderness and stiffness, impaired memory, constipation, increased sensitivity to cold, pain, stiffness or swelling in your joints, dry skin",Hypothyroidism
"increased sensitivity to cold, depression, slowed heart rate, weight gain, hoarseness, pain, stiffness or swelling in your joints, puffy face, muscle weakness, constipation, heavy or irregular menstrual periods, thinning hair, elevated blood cholesterol, dry skin",Hypothyroidism
"slow-healing sores, numbness or tingling in the hands or feet, frequent urination, areas of darkened skin, unintended weight loss, fatigue, frequent infections, increased hunger, blurred vision",Diabetes Type 2
"skin rash, fatigue, severe headache, nausea, severe joint and muscle pain, pain behind eyes, sudden high fever",Dengue
"pale or yellowish skin, weakness, cold hands and feet, headache, shortness of breath, dizziness or lightheadedness, irregular heartbeats, fatigue, chest pain",Anemia
sneezing,Common Cold
"pain, stiffness or swelling in your joints, increased sensitivity to cold, muscle aches, impaired memory, slowed heart rate, weight gain, elevated blood cholesterol, puffy face, constipation, fatigue, muscle weakness, hoarseness, depression, thinning hair, dry skin, tenderness and stiffness, heavy or irregular menstrual periods",Hypothyroidism
"headache, body ache",Viral Fever
slow-healing sores,Diabetes Type 2
"hoarseness, heavy or irregular menstrual periods, tenderness and stiffness",Hypothyroidism
"headache, vomiting, anemia, nausea, muscle pain, abdominal pain, diarrhea, fever with shaking chills",Malaria
"fever with shaking chills, anemia, sweating, headache, muscle pain, diarrhea",Malaria
"loss of appetite, sweating, weight loss, headache, muscle ache, diarrhea or constipation, fatigue, weakness, prolonged fever",Typhoid
congestion,Common Cold
"increased hunger, unintended weight loss, slow-healing sores",Diabetes Type 2
"weight loss, weakness, muscle ache",Typhoid
"chest pain, dizziness or lightheadedness",Anemia
"nausea, diarrhea, vomiting, headache, abdominal pain, sweating, fever with shaking chills",Malaria
"fever with shaking chills, headache",Malaria
"sweating, nausea, fever with shaking chills, headache, anemia, muscle pain, vomiting, abdominal pain, diarrhea",Malaria
"unintended weight loss, frequent infections, fatigue, areas of darkened skin",Diabetes Type 2
"weight loss, fatigue, rash, dry cough, headache, loss of appetite, sweating",Typhoid
"abdominal pain, muscle pain, vomiting, sweating, anemia, nausea, fever with shaking chills, diarrhea",Malaria
"cough, slight body aches, sneezing, mild headache, malaise, sore throat, congestion",Common Cold
"unintended weight loss, frequent urination, frequent infections, increased thirst, blurred vision, increased hunger",Diabetes Type 2
"headache, loss of appetite, fatigue, measured high fever, chills, body ache, weakness",Viral Fever
"increased thirst, fatigue",Diabetes Type 2
"unintended weight loss, increased thirst, areas of darkened skin, slow-healing sores, numbness or tingling in the hands or feet",Diabetes Type 2
"prolonged fever, rash, weight loss, dry cough, muscle ache, sweating, weakness, headache",Typhoid
"sweating, dry cough, fatigue, rash, loss of appetite, headache, weakness, diarrhea or constipation, abdominal pain",Typhoid
"blurred vision, numbness or tingling in the hands or feet, fatigue, unintended weight loss, slow-healing sores, increased hunger",Diabetes Type 2
"body ache, weakness, fatigue, chills, headache, measured high fever",Viral Fever
"pale or yellowish skin, cold hands and feet, chest pain, weakness, irregular heartbeats, shortness of breath, fatigue, headache",Anemia
"numbness or tingling in the hands or feet, frequent urination, slow-healing sores, fatigue, areas of darkened skin, unintended weight loss, increased hunger, frequent infections, increased thirst",Diabetes Type 2
"slow-healing sores, frequent urination, fatigue, increased hunger, areas of darkened skin",Diabetes Type 2
"muscle weakness, heavy or irregular menstrual periods, impaired memory, muscle aches, weight gain, pain, stiffness or swelling in your joints, fatigue, puffy face, hoarseness, dry skin, thinning hair, tenderness and stiffness, elevated blood cholesterol, increased sensitivity to cold",Hypothyroidism
"cold hands and feet, headache, dizziness or lightheadedness, shortness of breath, fatigue",Anemia
"headache, fatigue, chills, weakness, measured high fever",Viral Fever
"weakness, pale or yellowish skin, dizziness or lightheadedness, fatigue, chest pain, cold hands and feet, shortness of breath, headache, irregular heartbeats",Anemia
"increased hunger, increased thirst, unintended weight loss, areas of darkened skin, numbness or tingling in the hands or feet, frequent urination, fatigue",Diabetes Type 2
"numbness or tingling in the hands or feet, frequent infections, increased thirst, slow-healing sores, frequent urination, unintended weight loss, areas of darkened skin, fatigue",Diabetes Type 2
"sneezing, cough, low-grade fever",Common Cold
fatigue,Viral Fever
"fatigue, slowed heart rate, pain, stiffness or swelling in your joints, muscle aches, tenderness and stiffness, weight gain, muscle weakness, heavy or irregular menstrual periods",Hypothyroidism
"chest pain, pale or yellowish skin",Anemia
"abdominal pain, diarrhea, muscle pain, sweating, nausea, fever with shaking chills",Malaria
measured high fever,Viral Fever
"sore throat, cough, sneezing, slight body aches, low-grade fever, mild headache, congestion",Common Cold
"cough, sore throat, low-grade fever, congestion, sneezing, runny or stuffy nose",Common Cold
"congestion, runny or stuffy nose, cough, low-grade fever, slight body aches",Common Cold
"dizziness or lightheadedness, fatigue, weakness",Anemia
"slowed heart rate, hoarseness, impaired memory, thinning hair, increased sensitivity to cold, puffy face, constipation, tenderness and stiffness, depression, dry skin, heavy or irregular menstrual periods, elevated blood cholesterol, muscle weakness, muscle aches, fatigue, pain, stiffness or swelling in your joints, weight gain",Hypothyroidism
"fever with shaking chills, nausea, abdominal pain, sweating, headache, vomiting, muscle pain, diarrhea",Malaria
"diarrhea or constipation, fatigue, sweating, headache, dry cough, rash, prolonged fever",Typhoid
"body ache, loss of appetite, fatigue, headache, weakness, chills",Viral Fever
"weakness, dizziness or lightheadedness, irregular heartbeats, cold hands and feet, fatigue, pale or yellowish skin, headache",Anemia
"dry skin, constipation, fatigue, depression",Hypothyroidism
"anemia, abdominal pain, nausea, fever with shaking chills",Malaria
"sweating, dry cough, muscle ache, abdominal pain",Typhoid
"sore throat, malaise, low-grade fever, mild headache",Common Cold
"fatigue, loss of appetite, measured high fever",Viral Fever
"fatigue, dizziness or lightheadedness",Anemia
"numbness or tingling in the hands or feet, unintended weight loss, blurred vision, increased hunger, slow-healing sores, frequent urination, frequent infections, areas of darkened skin",Diabetes Type 2
"constipation, impaired memory, elevated blood cholesterol",Hypothyroidism
"sneezing, malaise, congestion, mild headache, runny or stuffy nose, sore throat",Common Cold
"low-grade fever, congestion, sneezing",Common Cold
"impaired memory, tenderness and stiffness, weight gain, constipation, muscle aches, muscle weakness, fatigue",Hypothyroidism
measured high fever,Viral Fever
"mild bleeding, vomiting, severe joint and muscle pain",Dengue
"fatigue, body ache, loss of appetite, measured high fever",Viral Fever
"irregular heartbeats, dizziness or lightheadedness",Anemia
shortness of breath,Anemia
"headache, measured high fever, weakness, fatigue",Viral Fever
"weakness, prolonged fever, fatigue, diarrhea or constipation, rash, abdominal pain, loss of appetite, headache, muscle ache, sweating",Typhoid
"loss of appetite, sweating, headache, abdominal pain, rash, dry cough, diarrhea or constipation, prolonged fever, muscle ache",Typhoid
"fever with shaking chills, abdominal pain, sweating, muscle pain, nausea, anemia, vomiting",Malaria
"weakness, muscle ache, abdominal pain, loss of appetite, diarrhea or constipation, dry cough, fatigue, prolonged fever, weight loss, headache, sweating, rash",Typhoid
"areas of darkened skin, increased thirst, fatigue, slow-healing sores, blurred vision, frequent infections, numbness or tingling in the hands or feet",Diabetes Type 2
"severe headache, pain behind eyes, mild bleeding, severe joint and muscle pain, nausea, fatigue, vomiting",Dengue
"nausea, fever with shaking chills, muscle pain, diarrhea, abdominal pain, sweating, vomiting",Malaria
"unintended weight loss, frequent urination, fatigue, numbness or tingling in the hands or feet, increased hunger, blurred vision, frequent infections, slow-healing sores, increased thirst",Diabetes Type 2
"headache, body ache, measured high fever",Viral Fever
